original,cleaned
"Good afternoon, my boytoy ... How are you feeling today ? Better I hope? Are you being my good boy? Are you my obedient, slave? Do you please your Queen?",good afternoon my boytoy how you feeling today better i hope you being my good boy you my obedient slave do you please your queen
I am 6 ft. We will be a good combination!,i am NUM ft we will be good combination
I'm sick !! I'm needy !! I want you !! *pouts* *stomps feet* Where are you ?! *pouts* *stomps feet* I want my slave !! I want him now !!,i m sick i m needy i want you pouts stomps feet where you pouts stomps feet i want my slave i want him now
* Am on a train back from northampton so i'm afraid not!,am train back from northampton so i m afraid not
Where in abj are you serving. Are you staying with dad or alone.,where abj you serving you staying with dad alone
Was playng 9 doors game and gt racing on phone lol,was playng NUM doors game gt racing phone lol
"New Tones This week include: 1)McFly-All Ab.., 2) Sara Jorge-Shock.. 3) Will Smith-Switch.. To order follow instructions on next message",new tones this week include NUM mcfly all ab NUM sara jorge shock NUM will smith switch order follow instructions next message
"Solve d Case : A Man Was Found Murdered On  &lt;DECIMAL&gt; . &lt;#&gt;  AfterNoon. 1,His wife called Police. 2,Police questioned everyone. 3,Wife: Sir,I was sleeping, when the murder took place. 4.Cook: I was cooking. 5.Gardener: I was picking vegetables. 6.House-Maid: I went 2 d post office. 7.Children: We went 2 play. 8.Neighbour: We went 2 a marriage. Police arrested d murderer Immediately. Who's It? Reply With Reason, If U r Brilliant.",solve d case man was found murdered lt decimal gt lt gt afternoon NUM his wife called police NUM police questioned everyone NUM wife sir i was sleeping when murder took place NUM cook i was cooking NUM gardener i was picking vegetables NUM house maid i went NUM d post office NUM children we went NUM play NUM neighbour we went NUM marriage police arrested d murderer immediately who s it reply with reason u r brilliant
I'm on da bus going home...,i m da bus going home
I got a call from a landline number. . . I am asked to come to anna nagar . . . I will go in the afternoon,i got call from landline number i am asked come anna nagar i will go afternoon
I'm okay. Chasing the dream. What's good. What are you doing next.,i m okay chasing dream what s good what you doing next
Yupz... I've oredi booked slots 4 my weekends liao...,yupz i ve oredi booked slots NUM my weekends liao
URGENT! We are trying to contact U. Todays draw shows that you have won a £800 prize GUARANTEED. Call 09050003091 from land line. Claim C52. Valid 12hrs only,urgent we trying contact u todays draw shows that you have won £ NUM prize guaranteed call PHONE from land line claim c52 valid 12hrs only
There r many model..sony ericson also der.. &lt;#&gt; ..it luks good bt i forgot modl no,there r many model sony ericson also der lt gt it luks good bt i forgot modl no
Okie,okie
Yes I know the cheesy songs from frosty the snowman :),yes i know cheesy songs from frosty snowman
"Ya ok, vikky vl c witin  &lt;#&gt; mins and il reply u..",ya ok vikky vl c witin lt gt mins il reply u
sports fans - get the latest sports news str* 2 ur mobile 1 wk FREE PLUS a FREE TONE Txt SPORT ON to 8007 www.getzed.co.uk 0870141701216+ norm 4txt/120p,sports fans get latest sports news str NUM ur mobile NUM wk free plus free tone txt sport NUM URL PHONE norm 4txt 120p
Hey tmr meet at bugis 930 ?,hey tmr meet at bugis NUM
"Urgent Urgent! We have 800 FREE flights to Europe to give away, call B4 10th Sept & take a friend 4 FREE. Call now to claim on 09050000555. BA128NNFWFLY150ppm",urgent urgent we have NUM free flights europe give away call b4 10th sept take friend NUM free call now claim PHONE ba128nnfwfly150ppm
All these nice new shirts and the only thing I can wear them to is nudist themed ;_; you in mu?,all these nice new shirts only thing i can wear them nudist themed _ you mu
Hey sexy buns! What of that day? No word from you this morning on YM ... :-( ... I think of you,hey sexy buns what that day no word from you this morning ym i think you
And whenever you and i see we can still hook up too.,whenever you i see we can still hook up too
Nope but i'm going home now then go pump petrol lor... Like going 2 rain soon...,nope i m going home now then go pump petrol lor like going NUM rain soon
Can you use foreign stamps for whatever you send them off for?,can you use foreign stamps whatever you send them off
FROM 88066 LOST £12 HELP,from NUM lost £ NUM help
Oh baby of the house. How come you dont have any new pictures on facebook,oh baby house how come you dont have any new pictures facebook
"Feb  &lt;#&gt;  is ""I LOVE U"" day. Send dis to all ur ""VALUED FRNDS"" evn me. If 3 comes back u'll gt married d person u luv! If u ignore dis u will lose ur luv 4 Evr",feb lt gt i love u day send dis all ur valued frnds evn me NUM comes back u ll gt married d person u luv u ignore dis u will lose ur luv NUM evr
"Hiya, sorry didn't hav signal. I haven't seen or heard from and neither has, which is unusual in itself! I'll put on the case and get him to sort it out! Hugs and snogs.",hiya sorry didn t hav signal i haven t seen heard from neither has which unusual itself i ll put case get him sort it out hugs snogs
"Omw back to tampa from west palm, you hear what happened?",omw back tampa from west palm you hear what happened
Yup no more already... Thanx 4 printing n handing it up.,yup no more already thanx NUM printing n handing it up
FreeMsg: Fancy a flirt? Reply DATE now & join the UKs fastest growing mobile dating service. Msgs rcvd just 25p to optout txt stop to 83021. Reply DATE now!,freemsg fancy flirt reply date now join uks fastest growing mobile dating service msgs rcvd just 25p optout txt stop NUM reply date now
What i mean is do they come chase you out when its over or is it stated you can watch as many movies as you want.,what i mean do they come chase you out when its over it stated you can watch as many movies as you want
S now only i took tablets . Reaction morning only.,s now only i took tablets reaction morning only
Great NEW Offer - DOUBLE Mins & DOUBLE Txt on best Orange tariffs AND get latest camera phones 4 FREE! Call MobileUpd8 free on 08000839402 NOW! or 2stoptxt T&Cs,great new offer double mins double txt best orange tariffs get latest camera phones NUM free call mobileupd8 free PHONE now 2stoptxt t cs
"Nah, I'm a perpetual DD",nah i m perpetual dd
Sorry de i went to shop.,sorry de i went shop
Hope you enjoyed your new content. text stop to 61610 to unsubscribe. help:08712400602450p Provided by tones2you.co.uk,hope you enjoyed your new content text stop NUM unsubscribe help 08712400602450p provided by tones2you co uk
"Wen ur lovable bcums angry wid u, dnt take it seriously.. Coz being angry is d most childish n true way of showing deep affection, care n luv!.. kettoda manda... Have nice day da.",wen ur lovable bcums angry wid u dnt take it seriously coz being angry d most childish n true way showing deep affection care n luv kettoda manda have nice day da
Hey you still want to go for yogasana? Coz if we end at cine then can go bathe and hav the steam bath,hey you still want go yogasana coz we end at cine then can go bathe hav steam bath
Nope i'm not drivin... I neva develop da photos lei...,nope i m not drivin i neva develop da photos lei
I am thinking of going down to reg for pract lessons.. Flung my advance.. Haha wat time u going?,i am thinking going down reg pract lessons flung my advance haha wat time u going
Cool. I am  &lt;#&gt;  inches long. hope you like them big!,cool i am lt gt inches long hope you like them big
"House-Maid is the murderer, coz the man was murdered on  &lt;#&gt; th January.. As public holiday all govt.instituitions are closed,including post office..understand?",house maid murderer coz man was murdered lt gt th january as public holiday all govt instituitions closed including post office understand
Okie.. Thanx..,okie thanx
18 days to Euro2004 kickoff! U will be kept informed of all the latest news and results daily. Unsubscribe send GET EURO STOP to 83222.,NUM days euro2004 kickoff u will be kept informed all latest news results daily unsubscribe send get euro stop NUM
Go where n buy? Juz buy when we get there lar.,go where n buy juz buy when we get there lar
Ok lor...,ok lor
I'm working technical support :)voice process.,i m working technical support voice process
It's justbeen overa week since we broke up and already our brains are going to mush!,it s justbeen overa week since we broke up already our brains going mush
"Tunde, how are you doing. This is just wishing you a great day. Abiola.",tunde how you doing this just wishing you great day abiola
Nope... C ü then...,nope c ü then
No. But we'll do medical missions to nigeria,no we ll do medical missions nigeria
No i am not having not any movies in my laptop,no i am not having not any movies my laptop
Whatsup there. Dont u want to sleep,whatsup there dont u want sleep
Urgent Please call 09066612661 from landline. £5000 cash or a luxury 4* Canary Islands Holiday await collection. T&Cs SAE award. 20M12AQ. 150ppm. 16+ “,urgent please call PHONE from landline £ NUM cash luxury NUM canary islands holiday await collection t cs sae award 20m12aq 150ppm NUM “
"Urgent! Please call 09066612661 from your landline, your complimentary 4* Lux Costa Del Sol holiday or £1000 CASH await collection. ppm 150 SAE T&Cs James 28, EH74RR",urgent please call PHONE from your landline your complimentary NUM lux costa del sol holiday £ NUM cash await collection ppm NUM sae t cs james NUM eh74rr
I havent lei.. Next mon can?,i havent lei next mon can
Mm feeling sleepy. today itself i shall get that dear,mm feeling sleepy today itself i shall get that dear
How dare you stupid. I wont tell anything to you. Hear after i wont talk to you:-.,how dare you stupid i wont tell anything you hear after i wont talk you
Do ü noe if ben is going?,do ü noe ben going
Can you do a mag meeting this avo at some point?,can you do mag meeting this avo at some point
I meant middle left or right?,i meant middle left right
Really? I crashed out cuddled on my sofa.,really i crashed out cuddled my sofa
Hi Chachi tried calling u now unable to reach u .. Pl give me a missed cal once u c tiz msg  Kanagu,hi chachi tried calling u now unable reach u pl give me missed cal once u c tiz msg kanagu
"I sent you the prices and do you mean the  &lt;#&gt; g,",i sent you prices do you mean lt gt g
Are you this much buzy,you this much buzy
Nothing. Can...,nothing can
I don't know u and u don't know me. Send CHAT to 86688 now and let's find each other! Only 150p/Msg rcvd. HG/Suite342/2Lands/Row/W1J6HL LDN. 18 years or over.,i don t know u u don t know me send chat NUM now let s find each other only 150p msg rcvd hg suite342 2lands row w1j6hl ldn NUM years over
No * am working on the ringing u thing but have whole houseful of screaming brats so * am pulling my hair out! Loving u,no am working ringing u thing have whole houseful screaming brats so am pulling my hair out loving u
But my family not responding for anything. Now am in room not went to home for diwali but no one called me and why not coming. It makes me feel like died.,my family not responding anything now am room not went home diwali no one called me why not coming it makes me feel like died
"Tick, tick, tick ... Babe",tick tick tick babe
R ü going 4 today's meeting?,r ü going NUM today s meeting
K da:)how many page you want?,k da how many page you want
Ya had just now.onion roast.,ya had just now onion roast
Send his number and give reply tomorrow morning for why you said that to him like that ok,send his number give reply tomorrow morning why you said that him like that ok
You said not now. No problem. When you can. Let me know.,you said not now no problem when you can let me know
Ok but tell me half an hr b4 u come i need 2 prepare.,ok tell me half hr b4 u come i need NUM prepare
Play w computer? Aiyah i tok 2 u lor?,play w computer aiyah i tok NUM u lor
Sat right? Okay thanks...,sat right okay thanks
"Derp. Which is worse, a dude who always wants to party or a dude who files a complaint about the three drug abusers he lives with",derp which worse dude who always wants party dude who files complaint about three drug abusers he lives with
Ok Chinese food on its way. When I get fat you're paying for my lipo.,ok chinese food its way when i get fat you re paying my lipo
We r outside already.,we r outside already
Have a good trip. Watch out for . Remember when you get back we must decide about easter.,have good trip watch out remember when you get back we must decide about easter
Yo we are watching a movie on netflix,yo we watching movie netflix
What time. I‘m out until prob 3 or so,what time i‘m out until prob NUM so
"Can meh? Thgt some will clash... Really ah, i dun mind... I dun seen to have lost any weight... Gee...",can meh thgt some will clash really ah i dun mind i dun seen have lost any weight gee
I dont thnk its a wrong calling between us,i dont thnk its wrong calling between us
I am not sure about night menu. . . I know only about noon menu,i am not sure about night menu i know only about noon menu
ARR birthday today:) i wish him to get more oscar.,arr birthday today i wish him get more oscar
"Say this slowly.? GOD,I LOVE YOU &amp; I NEED YOU,CLEAN MY HEART WITH YOUR BLOOD.Send this to Ten special people &amp; u c miracle tomorrow, do it,pls,pls do it...",say this slowly god i love you amp i need you clean my heart with your blood send this ten special people amp u c miracle tomorrow do it pls pls do it
"Open rebtel with firefox. When it loads just put plus sign in the user name place, and it will show you two numbers. The lower number is my number. Once you pick that number the pin will display okay!",open rebtel with firefox when it loads just put plus sign user name place it will show you two numbers lower number my number once you pick that number pin will display okay
and  picking them up from various points,picking them up from various points
Married local women looking for discreet action now! 5 real matches instantly to your phone. Text MATCH to 69969 Msg cost 150p 2 stop txt stop BCMSFWC1N3XX,married local women looking discreet action now NUM real matches instantly your phone text match NUM msg cost 150p NUM stop txt stop bcmsfwc1n3xx
Wow v v impressed. Have funs shopping!,wow v v impressed have funs shopping
I am on the way to ur home,i am way ur home
Burger King - Wanna play footy at a top stadium? Get 2 Burger King before 1st Sept and go Large or Super with Coca-Cola and walk out a winner,burger king wanna play footy at top stadium get NUM burger king before 1st sept go large super with coca cola walk out winner
No problem. Talk to you later,no problem talk you later
Then ur sis how?,then ur sis how
Still in customer place,still customer place
How come it takes so little time for a child who is afraid of the dark to become a teenager who wants to stay out all night?,how come it takes so little time child who afraid dark become teenager who wants stay out all night
"Dude u knw also telugu..thts gud..k, gud nyt..",dude u knw also telugu thts gud k gud nyt
We confirm eating at esplanade?,we confirm eating at esplanade
Send me your id and password,send me your id password
Kind of. Took it to garage. Centre part of exhaust needs replacing. Part ordered n taking it to be fixed tomo morning.,kind took it garage centre part exhaust needs replacing part ordered n taking it be fixed tomo morning
"For ur chance to win a £250 cash every wk TXT: ACTION to 80608. T's&C's www.movietrivia.tv custcare 08712405022, 1x150p/wk.",ur chance win £ NUM cash every wk txt action NUM t s c s URL custcare PHONE 1x150p wk
Well I might not come then...,well i might not come then
Long after I quit. I get on only like 5 minutes a day as it is.,long after i quit i get only like NUM minutes day as it
Then its most likely called Mittelschmertz. Google it. If you dont have paracetamol dont worry it will go.,then its most likely called mittelschmertz google it you dont have paracetamol dont worry it will go
Well at this right I'm gonna have to get up and check today's steam sales/pee so text me when you want me to come get you,well at this right i m gonna have get up check today s steam sales pee so text me when you want me come get you
"Just arrived, see you in a couple days &lt;3",just arrived see you couple days lt NUM
"K, wat s tht incident?",k wat s tht incident
Yeah get the unlimited,yeah get unlimited
cThen i thk shd b enuff.. Still got conclusion n contents pg n references.. I'll b doing da contents pg n cover pg..,cthen i thk shd b enuff still got conclusion n contents pg n references i ll b doing da contents pg n cover pg
"Forgot it takes me 3 years to shower, sorry. Where you at/your phone dead yet?",forgot it takes me NUM years shower sorry where you at your phone dead yet
Ü got wat to buy tell us then ü no need to come in again.,ü got wat buy tell us then ü no need come again
When you are big..| God will bring success.,when you big | god will bring success
U’ve Bin Awarded £50 to Play 4 Instant Cash. Call 08715203028 To Claim. EVERY 9th Player Wins Min £50-£500. OptOut 08718727870,u’ve bin awarded £ NUM play NUM instant cash call PHONE claim every 9th player wins min £ NUM £ NUM optout PHONE
"… we r stayin here an extra week, back next wed. How did we do in the rugby this weekend? Hi to and and , c u soon """,… we r stayin here extra week back next wed how did we do rugby this weekend hi c u soon
Well there's still a bit left if you guys want to tonight,well there s still bit left you guys want tonight
Not from this campus. Are you in the library?,not from this campus you library
"The affidavit says  &lt;#&gt;  E Twiggs St, division g, courtroom  &lt;#&gt; , &lt;TIME&gt;  AM. I'll double check and text you again tomorrow",affidavit says lt gt e twiggs st division g courtroom lt gt lt time gt am i ll double check text you again tomorrow
How will I creep on you now? ;_;,how will i creep you now _
Tell your friends what you plan to do on Valentines day @ &lt;URL&gt;,tell your friends what you plan do valentines day lt url gt
If I get there before you after your ten billion calls and texts so help me god,i get there before you after your ten billion calls texts so help me god
Purity of friendship between two is not about smiling after reading the forwarded message..Its about smiling just by seeing the name. Gud evng musthu,purity friendship between two not about smiling after reading forwarded message its about smiling just by seeing name gud evng musthu
I've told him that i've returned it. That should i re order it.,i ve told him that i ve returned it that should i re order it
"House-Maid is the murderer, coz the man was murdered on  &lt;#&gt; th January.. As public holiday all govt.instituitions are closed,including post office..",house maid murderer coz man was murdered lt gt th january as public holiday all govt instituitions closed including post office
Depends on where u going lor.,depends where u going lor
And smile for me right now as you go and the world will wonder what you are smiling about and think your crazy and keep away from you ... *grins*,smile me right now as you go world will wonder what you smiling about think your crazy keep away from you grins
FreeMsg>FAV XMAS TONES!Reply REAL,freemsg fav xmas tones reply real
Lil fever:) now fine:),lil fever now fine
I think it's all still in my car,i think it s all still my car
Can a not?,can not
December only! Had your mobile 11mths+? You are entitled to update to the latest colour camera mobile for Free! Call The Mobile Update Co FREE on 08002986906,december only had your mobile 11mths you entitled update latest colour camera mobile free call mobile update co free PHONE
Yes princess! I want to catch you with my big strong hands...,yes princess i want catch you with my big strong hands
Oh yeah I forgot. U can only take 2 out shopping at once.,oh yeah i forgot u can only take NUM out shopping at once
Mm so you asked me not to call radio,mm so you asked me not call radio
Thinkin about someone is all good. No drugs for that,thinkin about someone all good no drugs that
"Say this slowly.? GOD,I LOVE YOU &amp; I NEED YOU,CLEAN MY HEART WITH YOUR BLOOD.Send this to Ten special people &amp; u c miracle tomorrow, do it,pls,pls do it...",say this slowly god i love you amp i need you clean my heart with your blood send this ten special people amp u c miracle tomorrow do it pls pls do it
"Enjoy the showers of possessiveness poured on u by ur loved ones, bcoz in this world of lies, it is a golden gift to be loved truly..",enjoy showers possessiveness poured u by ur loved ones bcoz this world lies it golden gift be loved truly
"Alright if you're sure, let me know when you're leaving",alright you re sure let me know when you re leaving
Some are lasting as much as 2 hours. You might get lucky.,some lasting as much as NUM hours you might get lucky
Genius what's up. How your brother. Pls send his number to my skype.,genius what s up how your brother pls send his number my skype
"Gr8 Poly tones 4 ALL mobs direct 2u rply with POLY TITLE to 8007 eg POLY BREATHE1 Titles: CRAZYIN, SLEEPINGWITH, FINEST, YMCA :getzed.co.uk POBox365O4W45WQ 300p",gr8 poly tones NUM all mobs direct 2u rply with poly title NUM eg poly breathe1 titles crazyin sleepingwith finest ymca getzed co uk pobox365o4w45wq 300p
Thk some of em find wtc too far... Weiyi not goin... E rest i dunno yet... R ur goin 4 dinner den i might b able to join...,thk some em find wtc too far weiyi not goin e rest i dunno yet r ur goin NUM dinner den i might b able join
Don't forget who owns you and who's private property you are ... And be my good boy always .. *passionate kiss*,don t forget who owns you who s private property you be my good boy always passionate kiss
INTERFLORA - It's not too late to order Interflora flowers for christmas call 0800 505060 to place your order before Midnight tomorrow.,interflora it s not too late order interflora flowers christmas call PHONE place your order before midnight tomorrow
Oh god..taken the teeth?is it paining,oh god taken teeth it paining
ROMCAPspam Everyone around should be responding well to your presence since you are so warm and outgoing. You are bringing in a real breath of sunshine.,romcapspam everyone around should be responding well your presence since you so warm outgoing you bringing real breath sunshine
Then u ask darren go n pick u lor... But i oso sian tmr haf 2 meet lect...,then u ask darren go n pick u lor i oso sian tmr haf NUM meet lect
No need to buy lunch for me.. I eat maggi mee..,no need buy lunch me i eat maggi mee
"Congratulations - Thanks to a good friend U have WON the £2,000 Xmas prize. 2 claim is easy, just call 08712103738 NOW! Only 10p per minute. BT-national-rate",congratulations thanks good friend u have won £ NUM NUM xmas prize NUM claim easy just call PHONE now only 10p per minute bt national rate
Ok lor...,ok lor
"Oh right, ok. I'll make sure that i do loads of work during the day!  got a really nasty cough today and is dry n shot so that should really help it!",oh right ok i ll make sure that i do loads work during day got really nasty cough today dry n shot so that should really help it
Wife.how she knew the time of murder exactly,wife how she knew time murder exactly
Send a logo 2 ur lover - 2 names joined by a heart. Txt LOVE NAME1 NAME2 MOBNO eg LOVE ADAM EVE 07123456789 to 87077 Yahoo! POBox36504W45WQ TxtNO 4 no ads 150p.,send logo NUM ur lover NUM names joined by heart txt love name1 name2 mobno eg love adam eve PHONE NUM yahoo pobox36504w45wq txtno NUM no ads 150p
Howz that persons story,howz that persons story
Thanx 4 sending me home...,thanx NUM sending me home
Its normally hot mail. Com you see!,its normally hot mail com you see
"You've won tkts to the EURO2004 CUP FINAL or £800 CASH, to collect CALL 09058099801 b4190604, POBOX 7876150ppm",you ve won tkts euro2004 cup final £ NUM cash collect call PHONE b4190604 pobox 7876150ppm
U sick still can go shopping?,u sick still can go shopping
"Ya they are well and fine., BBD(pooja) full pimples..even she become quite black..and ur rite here its too cold, wearing sweatter..",ya they well fine bbd pooja full pimples even she become quite black ur rite here its too cold wearing sweatter
Nice.nice.how is it working?,nice nice how it working
1's reach home call me.,NUM s reach home call me
Were trying to find a Chinese food place around here,were trying find chinese food place around here
"Easy mate, * guess the quick drink was bit ambitious.",easy mate guess quick drink was bit ambitious
BABE !!! I miiiiiiissssssssss you ! I need you !!! I crave you !!! :-( ... Geeee ... I'm so sad without you babe ... I love you ...,babe i miiiiiiissssssssss you i need you i crave you geeee i m so sad without you babe i love you
Ok thanx...,ok thanx
aathi..where are you dear..,aathi where you dear
"Tunji, how's the queen? how are you doing. This is just wishing you a great day. Abiola.",tunji how s queen how you doing this just wishing you great day abiola
Today iZ Yellow rose day. If u love my frndship give me 1 misscall &amp; send this to ur frndZ &amp; See how many miss calls u get. If u get 6missed U marry ur Lover.,today iz yellow rose day u love my frndship give me NUM misscall amp send this ur frndz amp see how many miss calls u get u get 6missed u marry ur lover
Will be out of class in a few hours. Sorry,will be out class few hours sorry
Wat time u finish ur lect today?,wat time u finish ur lect today
