original,cleaned
"Aight I've been set free, think you could text me blake's address? It occurs to me I'm not quite as sure what I'm doing as I thought I was",aight i ve been set free think you could text me blake s address it occurs me i m not quite as sure what i m doing as i thought i was
Hi dear we saw dear. We both are happy. Where you my battery is low,hi dear we saw dear we both happy where you my battery low
How are you. Its been ages. How's abj,how you its been ages how s abj
Prof: you have passed in all the papers in this sem congrats . . . . Student: Enna kalaachutaarama..!! Prof:???? Gud mrng!,prof you have passed all papers this sem congrats student enna kalaachutaarama prof gud mrng
Dont kick coco when he's down,dont kick coco when he s down
Fyi I'm gonna call you sporadically starting at like  &lt;#&gt;  bc we are not not doin this shit,fyi i m gonna call you sporadically starting at like lt gt bc we not not doin this shit
"You are being contacted by our Dating Service by someone you know! To find out who it is, call from your mobile or landline 09064017305 PoBox75LDNS7",you being contacted by our dating service by someone you know find out who it call from your mobile landline PHONE pobox75ldns7
TBS/PERSOLVO. been chasing us since Sept for£38 definitely not paying now thanks to your information. We will ignore them. Kath. Manchester.,tbs persolvo been chasing us since sept for£ NUM definitely not paying now thanks your information we will ignore them kath manchester
Hope you're not having too much fun without me!! see u tomorrow love jess x,hope you re not having too much fun without me see u tomorrow love jess x
Ok i wont call or disturb any one. I know all are avoiding me. I am a burden for all,ok i wont call disturb any one i know all avoiding me i am burden all
I've reached home n i bathe liao... U can call me now...,i ve reached home n i bathe liao u can call me now
Loans for any purpose even if you have Bad Credit! Tenants Welcome. Call NoWorriesLoans.com on 08717111821,loans any purpose even you have bad credit tenants welcome call noworriesloans com PHONE
Was the actual exam harder than NBME,was actual exam harder than nbme
A lot of this sickness thing going round. Take it easy. Hope u feel better soon. Lol,lot this sickness thing going round take it easy hope u feel better soon lol
"God picked up a flower and dippeditinaDEW, lovingly touched itwhichturnedinto u, and the he gifted tomeandsaid,THIS FRIEND IS 4U",god picked up flower dippeditinadew lovingly touched itwhichturnedinto u he gifted tomeandsaid this friend 4u
87077: Kick off a new season with 2wks FREE goals & news to ur mobile! Txt ur club name to 87077 eg VILLA to 87077,NUM kick off new season with 2wks free goals news ur mobile txt ur club name NUM eg villa NUM
Hey sathya till now we dint meet not even a single time then how can i saw the situation sathya.,hey sathya till now we dint meet not even single time then how can i saw situation sathya
Gam gone after outstanding innings.,gam gone after outstanding innings
O i played smash bros  &lt;#&gt;  religiously.,o i played smash bros lt gt religiously
"Sir, good morning. Hope you had a good weekend. I called to let you know that i was able to raise  &lt;#&gt;  from my dad. He however said he would make the rest available by mid feb. This amount is still quite short and i was hoping you would help. Do have a good day. Abiola",sir good morning hope you had good weekend i called let you know that i was able raise lt gt from my dad he however said he would make rest available by mid feb this amount still quite short i was hoping you would help do have good day abiola
Hurry home. Soup is DONE!,hurry home soup done
No no. I will check all rooms befor activities,no no i will check all rooms befor activities
"Good afternoon, my love. It was good to see your words on YM and get your tm. Very smart move, my slave ... *smiles* ... I drink my coffee and await you.",good afternoon my love it was good see your words ym get your tm very smart move my slave smiles i drink my coffee await you
Quite ok but a bit ex... U better go eat smth now else i'll feel guilty...,quite ok bit ex u better go eat smth now else i ll feel guilty
"Orange brings you ringtones from all time Chart Heroes, with a free hit each week! Go to Ringtones & Pics on wap. To stop receiving these tips reply STOP.",orange brings you ringtones from all time chart heroes with free hit each week go ringtones pics wap stop receiving these tips reply stop
Lemme know when you're here,lemme know when you re here
PRIVATE! Your 2003 Account Statement for 07973788240 shows 800 un-redeemed S. I. M. points. Call 08715203649 Identifier Code: 40533 Expires 31/10/04,private your NUM account statement PHONE shows NUM un redeemed s i m points call PHONE identifier code NUM expires NUM NUM NUM
He needs to stop going to bed and make with the fucking dealing,he needs stop going bed make with fucking dealing
"How are you, my Love ? Are you with your brother ? Time to talk english with him ? *grins* Say : Hey Muhommad, Penny says hello from across the sea",how you my love you with your brother time talk english with him grins say hey muhommad penny says hello from across sea
We tried to call you re your reply to our sms for a video mobile 750 mins UNLIMITED TEXT + free camcorder Reply of call 08000930705 Now,we tried call you re your reply our sms video mobile NUM mins unlimited text free camcorder reply call PHONE now
"Hey doc pls I want to get nice t shirt for my hubby nice fiting ones my budget is  &lt;#&gt; k help pls I will load d card abi hw,keep me posted luv. 2 mj",hey doc pls i want get nice t shirt my hubby nice fiting ones my budget lt gt k help pls i will load d card abi hw keep me posted luv NUM mj
I remain unconvinced that this isn't an elaborate test of my willpower,i remain unconvinced that this isn t elaborate test my willpower
"""Life is nothing wen v get everything"". But ""life is everything wen v miss something "". Real value of people wil be realized only in their absence.... gud mrng",life nothing wen v get everything life everything wen v miss something real value people wil be realized only their absence gud mrng
how are you? I miss you!,how you i miss you
I ain't answerin no phone at what is actually a pretty reasonable hour but I'm sleepy,i ain t answerin no phone at what actually pretty reasonable hour i m sleepy
"Hey , is * rite u put »10 evey mnth is that all?",hey rite u put » NUM evey mnth that all
i am going to bed now prin,i am going bed now prin
I think just yourself …Thanks and see you tomo,i think just yourself …thanks see you tomo
If u dun drive then how i go 2 sch.,u dun drive then how i go NUM sch
I not at home now lei...,i not at home now lei
GSOH? Good with SPAM the ladies?U could b a male gigolo? 2 join the uk's fastest growing mens club reply ONCALL. mjzgroup. 08714342399.2stop reply STOP. msg@£1.50rcvd,gsoh good with spam ladies u could b male gigolo NUM join uk s fastest growing mens club reply oncall mjzgroup PHONE 2stop reply stop msg £ NUM 50rcvd
Ok then i will come to ur home after half an hour,ok then i will come ur home after half hour
U have a secret admirer who is looking 2 make contact with U-find out who they R*reveal who thinks UR so special-call on 09058094599,u have secret admirer who looking NUM make contact with u find out who they r reveal who thinks ur so special call PHONE
Do u hav any frnd by name ashwini in ur college?,do u hav any frnd by name ashwini ur college
Jus finish my lunch on my way home lor... I tot u dun wan 2 stay in sch today...,jus finish my lunch my way home lor i tot u dun wan NUM stay sch today
K then 2marrow are you coming to class.,k then 2marrow you coming class
"HOT LIVE FANTASIES call now 08707500020 Just 20p per min NTT Ltd, PO Box 1327 Croydon CR9 5WB 0870 is a national rate call",hot live fantasies call now PHONE just 20p per min ntt ltd po box NUM croydon cr9 5wb NUM national rate call
Pls send me your address sir.,pls send me your address sir
I want to lick your pussy now...,i want lick your pussy now
"Yo, you gonna still be in stock tomorrow/today? I'm trying to get a dubsack",yo you gonna still be stock tomorrow today i m trying get dubsack
URGENT! Your Mobile number has been awarded a <UKP>2000 prize GUARANTEED. Call 09061790125 from landline. Claim 3030. Valid 12hrs only 150ppm,urgent your mobile number has been awarded ukp NUM prize guaranteed call PHONE from landline claim NUM valid 12hrs only 150ppm
"I'll see, but prolly yeah",i ll see prolly yeah
Thought we could go out for dinner. I'll treat you! Seem ok?,thought we could go out dinner i ll treat you seem ok
Where are you ? What do you do ? How can you stand to be away from me ? Doesn't your heart ache without me ? Don't you wonder of me ? Don't you crave me ?,where you what do you do how can you stand be away from me doesn t your heart ache without me don t you wonder me don t you crave me
Sorry. You never hear unless you book it. One was kinda a joke--thet were really looking for skinny white girls. The other was one line--you can only do so much on camera with that. Something like that they're casting on the look.,sorry you never hear unless you book it one was kinda joke thet were really looking skinny white girls other was one line you can only do so much camera with that something like that they re casting look
What you doing?how are you?,what you doing how you
"Sure thing big man. i have hockey elections at 6, shouldn‘t go on longer than an hour though",sure thing big man i have hockey elections at NUM shouldn‘t go longer than hour though
Watch lor. I saw a few swatch one i thk quite ok. Ard 116 but i need 2nd opinion leh...,watch lor i saw few swatch one i thk quite ok ard NUM i need 2nd opinion leh
Hiya do u like the hlday pics looked horrible in them so took mo out! Hows the camp Amrca thing? Speak soon Serena:),hiya do u like hlday pics looked horrible them so took mo out hows camp amrca thing speak soon serena
"Babe! How goes that day ? What are you up to ? I miss you already, my Love ... * loving kiss* ... I hope everything goes well.",babe how goes that day what you up i miss you already my love loving kiss i hope everything goes well
Yunny... I'm goin to be late,yunny i m goin be late
Doc prescribed me morphine cause the other pain meds aren't enough. Waiting for my mom to bring it. That med should kick in fast so I'm gonna try to be on later,doc prescribed me morphine cause other pain meds aren t enough waiting my mom bring it that med should kick fast so i m gonna try be later
"Cool, want me to go to kappa or should I meet you outside mu",cool want me go kappa should i meet you outside mu
"Hey sexy buns ! Have I told you ? I adore you, loverboy. I hope you remember to thank your sister in law for those meatballs *grins* ... i love you, babe",hey sexy buns have i told you i adore you loverboy i hope you remember thank your sister law those meatballs grins i love you babe
May b approve panalam...but it should have more posts..,may b approve panalam it should have more posts
"SPJanuary Male Sale! Hot Gay chat now cheaper, call 08709222922. National rate from 1.5p/min cheap to 7.8p/min peak! To stop texts call 08712460324 (10p/min)",spjanuary male sale hot gay chat now cheaper call PHONE national rate from NUM 5p min cheap NUM 8p min peak stop texts call PHONE 10p min
"Sorry, I'll call later",sorry i ll call later
I dont thnk its a wrong calling between us,i dont thnk its wrong calling between us
Me i'm not workin. Once i get job...,me i m not workin once i get job
And by when you're done I mean now,by when you re done i mean now
"""Its Ur luck to Love someone. Its Ur fortune to Love the one who Loves U. But, its a miracle to Love a person who can't Love anyone except U..."" Gud nyt...",its ur luck love someone its ur fortune love one who loves u its miracle love person who can t love anyone except u gud nyt
Hi baby ive just got back from work and i was wanting to see u allday! I hope i didnt piss u off on the phone today. If u are up give me a call xxx,hi baby ive just got back from work i was wanting see u allday i hope i didnt piss u off phone today u up give me call xxx
FreeMsg Today's the day if you are ready! I'm horny & live in your town. I love sex fun & games! Netcollex Ltd 08700621170150p per msg reply Stop to end,freemsg today s day you ready i m horny live your town i love sex fun games netcollex ltd 08700621170150p per msg reply stop end
Is it your yahoo boys that bring in the perf? Or legal.,it your yahoo boys that bring perf legal
No need to say anything to me. I know i am an outsider,no need say anything me i know i am outsider
have you ever had one foot before?,have you ever had one foot before
Just got to  &lt;#&gt;,just got lt gt
"Good! No, don‘t need any receipts—well done! (…) Yes, please tell . What‘s her number, i could ring her",good no don‘t need any receipts—well done … yes please tell what‘s her number i could ring her
"Ever green quote ever told by Jerry in cartoon ""A Person Who Irritates u Always Is the one Who Loves u Vry Much But Fails to Express It...!..!! :-) :-) gud nyt",ever green quote ever told by jerry cartoon person who irritates u always one who loves u vry much fails express it gud nyt
Leave it wif me lar... Ü wan to carry meh so heavy... Is da num 98321561 familiar to ü?,leave it wif me lar ü wan carry meh so heavy da num PHONE familiar ü
Beautiful truth : Expression of the face could Be seen by everyone... But the depression of heart Could be understood only By the Loved ones.. Gud Ni8;-),beautiful truth expression face could be seen by everyone depression heart could be understood only by loved ones gud ni8
Infact happy new year. How are you where are you when are we seeing,infact happy new year how you where you when we seeing
"In The Simpsons Movie released in July 2007 name the band that died at the start of the film? A-Green Day, B-Blue Day, C-Red Day. (Send A, B or C)",simpsons movie released july NUM name band that died at start film green day b blue day c red day send b c
That's a shame! Maybe cld meet for few hrs tomo?,that s shame maybe cld meet few hrs tomo
Lol I would but despite these cramps I like being a girl.,lol i would despite these cramps i like being girl
I can't wait for cornwall. Hope tonight isn't too bad as well but it's rock night shite. Anyway i'm going for a kip now have a good night. Speak to you soon.,i can t wait cornwall hope tonight isn t too bad as well it s rock night shite anyway i m going kip now have good night speak you soon
Pls help me tell sura that i'm expecting a battery from hont. And that if should pls send me a message about how to download movies. Thanks,pls help me tell sura that i m expecting battery from hont that should pls send me message about how download movies thanks
Please call Amanda with regard to renewing or upgrading your current T-Mobile handset free of charge. Offer ends today. Tel 0845 021 3680 subject to T's and C's,please call amanda with regard renewing upgrading your current t mobile handset free charge offer ends today tel PHONE subject t s c s
"Haven't found a way to get another app for your phone, eh ? Will you go to the net cafe ? Did you take that job? Geeee I need you babe. I crave to see you ...",haven t found way get another app your phone eh will you go net cafe did you take that job geeee i need you babe i crave see you
I only work from mon to thurs but Sat i cant leh... Booked liao... Which other day u free?,i only work from mon thurs sat i cant leh booked liao which other day u free
Ü comin to fetch us oredi...,ü comin fetch us oredi
What's nannys address?,what s nannys address
"URGENT!! Your 4* Costa Del Sol Holiday or £5000 await collection. Call 09050090044 Now toClaim. SAE, TC s, POBox334, Stockport, SK38xh, Cost£1.50/pm, Max10mins",urgent your NUM costa del sol holiday £ NUM await collection call PHONE now toclaim sae tc s pobox334 stockport sk38xh cost£ NUM NUM pm max10mins
Haf u eaten? Wat time u wan me 2 come?,haf u eaten wat time u wan me NUM come
Want a new Video Phone? 750 anytime any network mins? Half price line rental free text for 3 months? Reply or call 08000930705 for free delivery,want new video phone NUM anytime any network mins half price line rental free text NUM months reply call PHONE free delivery
"Yo, call me when you get the chance, a friend of mine wanted me to ask you about a big order",yo call me when you get chance friend mine wanted me ask you about big order
This single single answers are we fighting? Plus i said am broke and you didnt reply,this single single answers we fighting plus i said am broke you didnt reply
It certainly puts things into perspective when something like this happens,it certainly puts things into perspective when something like this happens
Now got tv 2 watch meh? U no work today?,now got tv NUM watch meh u no work today
i felt so...not any conveying reason.. Ese he... What about me?,i felt so not any conveying reason ese he what about me
Had your mobile 11 months or more? U R entitled to Update to the latest colour mobiles with camera for Free! Call The Mobile Update Co FREE on 08002986030,had your mobile NUM months more u r entitled update latest colour mobiles with camera free call mobile update co free PHONE
How's it going? Got any exciting karaoke type activities planned? I'm debating whether to play football this eve. Feeling lazy though.,how s it going got any exciting karaoke type activities planned i m debating whether play football this eve feeling lazy though
I told that am coming on wednesday.,i told that am coming wednesday
"Its ok, called mom instead have fun",its ok called mom instead have fun
"Dear Voucher Holder, To claim this weeks offer, at your PC please go to http://www.wtlp.co.uk/text. Ts&Cs apply.",dear voucher holder claim this weeks offer at your pc please go URL ts cs apply
Well if I'm that desperate I'll just call armand again,well i m that desperate i ll just call armand again
Are you at work right now ?,you at work right now
Congrats! Nokia 3650 video camera phone is your Call 09066382422 Calls cost 150ppm Ave call 3mins vary from mobiles 16+ Close 300603 post BCM4284 Ldn WC1N3XX,congrats nokia NUM video camera phone your call PHONE calls cost 150ppm ave call 3mins vary from mobiles NUM close NUM post bcm4284 ldn wc1n3xx
Haven't heard anything and he's not answering my texts so I'm guessing he flaked. That said the jb is fantastic,haven t heard anything he s not answering my texts so i m guessing he flaked that said jb fantastic
"Mmmmmm ... I love you,so much, Ahmad ... I can't wait for this year to begin as every second takes me closer to being at your side. Happy New Year, my love!!",mmmmmm i love you so much ahmad i can t wait this year begin as every second takes me closer being at your side happy new year my love
Pls what's the full name of joke's school cos fees in university of florida seem to actually be  &lt;#&gt; k. Pls holla back,pls what s full name joke s school cos fees university florida seem actually be lt gt k pls holla back
"Sorry, I'll call later",sorry i ll call later
Ok... But they said i've got wisdom teeth hidden inside n mayb need 2 remove.,ok they said i ve got wisdom teeth hidden inside n mayb need NUM remove
And pls pls drink plenty plenty water,pls pls drink plenty plenty water
How are you doing. How's the queen. Are you going for the royal wedding,how you doing how s queen you going royal wedding
He's in lag. That's just the sad part but we keep in touch thanks to skype,he s lag that s just sad part we keep touch thanks skype
Ok lor then we go tog lor...,ok lor then we go tog lor
Two teams waiting for some players,two teams waiting some players
Can ü send me a copy of da report?,can ü send me copy da report
"swhrt how u dey,hope ur ok, tot about u 2day.love n miss.take care.",swhrt how u dey hope ur ok tot about u 2day love n miss take care
"Ok da, i already planned. I wil pick you.",ok da i already planned i wil pick you
"Urgent! Please call 0906346330. Your ABTA complimentary 4* Spanish Holiday or £10,000 cash await collection SAE T&Cs BOX 47 PO19 2EZ 150ppm 18+",urgent please call PHONE your abta complimentary NUM spanish holiday £ NUM NUM cash await collection sae t cs box NUM po19 2ez 150ppm NUM
"Sorry, I'll call later in meeting",sorry i ll call later meeting
I just really need shit before tomorrow and I know you won't be awake before like 6,i just really need shit before tomorrow i know you won t be awake before like NUM
I'm good. Have you registered to vote?,i m good have you registered vote
"Hmm ok, i'll stay for like an hour cos my eye is really sore!",hmm ok i ll stay like hour cos my eye really sore
Dear got bus directly to calicut,dear got bus directly calicut
Mm umma ask vava also to come tell him can play later together,mm umma ask vava also come tell him can play later together
"Well the general price is  &lt;#&gt; /oz, let me know if/when/how much you want",well general price lt gt oz let me know when how much you want
"Sorry, I'll call later",sorry i ll call later
"Each Moment in a day,has its own value-Morning brings hope,afternoon brings faith,Evening brings luv,Night brings rest,Wish u find them all today.Good Morning",each moment day has its own value morning brings hope afternoon brings faith evening brings luv night brings rest wish u find them all today good morning
&lt;#&gt;  w jetton ave if you forgot,lt gt w jetton ave you forgot
Ok i'm coming home now.,ok i m coming home now
Can not use foreign stamps in this country.,can not use foreign stamps this country
"Double mins and txts 4 6months FREE Bluetooth on Orange. Available on Sony, Nokia Motorola phones. Call MobileUpd8 on 08000839402 or call2optout/N9DX",double mins txts NUM 6months free bluetooth orange available sony nokia motorola phones call mobileupd8 PHONE call2optout n9dx
"Sorry, it's a lot of friend-of-a-friend stuff, I'm just now about to talk to the actual guy who wants to buy",sorry it s lot friend friend stuff i m just now about talk actual guy who wants buy
FREE for 1st week! No1 Nokia tone 4 ur mob every week just txt NOKIA to 8007 Get txting and tell ur mates www.getzed.co.uk POBox 36504 W45WQ norm150p/tone 16+,free 1st week no1 nokia tone NUM ur mob every week just txt nokia NUM get txting tell ur mates URL pobox NUM w45wq norm150p tone NUM
"Want to funk up ur fone with a weekly new tone reply TONES2U 2 this text. www.ringtones.co.uk, the original n best. Tones 3GBP network operator rates apply",want funk up ur fone with weekly new tone reply tones2u NUM this text URL original n best tones 3gbp network operator rates apply
"cmon babe, make me horny, *turn* me on! Txt me your fantasy now babe -) Im hot, sticky and need you now. All replies cost £1.50. 2 cancel send STOP",cmon babe make me horny turn me txt me your fantasy now babe im hot sticky need you now all replies cost £ NUM NUM NUM cancel send stop
I will come tomorrow di,i will come tomorrow di
Wylie update: my weed dealer carlos went to freedom and had a class with lunsford,wylie update my weed dealer carlos went freedom had class with lunsford
Are you happy baby ? Are you alright ? Did you take that job ? I hope your fine. I send you a kiss to make you smile from across the sea ... *kiss* *kiss*,you happy baby you alright did you take that job i hope your fine i send you kiss make you smile from across sea kiss kiss
C movie is juz last minute decision mah. Juz watch 2 lar but i tot ü not interested.,c movie juz last minute decision mah juz watch NUM lar i tot ü not interested
How are you enjoying this semester? Take care brother.,how you enjoying this semester take care brother
IMPORTANT INFORMATION 4 ORANGE USER 0796XXXXXX. TODAY IS UR LUCKY DAY!2 FIND OUT WHY LOG ONTO http://www.urawinner.com THERE'S A FANTASTIC PRIZEAWAITING YOU!,important information NUM orange user 0796xxxxxx today ur lucky day NUM find out why log onto URL there s fantastic prizeawaiting you
"Get the door, I'm here",get door i m here
"Lets use it next week, princess :)",lets use it next week princess
Or i go home first lar ü wait 4 me lor.. I put down my stuff first..,i go home first lar ü wait NUM me lor i put down my stuff first
I want kfc its Tuesday. Only buy 2 meals ONLY 2. No gravy. Only 2 Mark. 2!,i want kfc its tuesday only buy NUM meals only NUM no gravy only NUM mark NUM
No da:)he is stupid da..always sending like this:)don believe any of those message.pandy is a mental:),no da he stupid da always sending like this don believe any those message pandy mental
Oi when you gonna ring,oi when you gonna ring
Missed call alert. These numbers called but left no message. 07008009200,missed call alert these numbers called left no message PHONE
I attended but nothing is there.,i attended nothing there
Ard 530 like dat lor. We juz meet in mrt station then ü dun haf to come out.,ard NUM like dat lor we juz meet mrt station then ü dun haf come out
No dear i was sleeping :-P,no dear i was sleeping p
Er mw im filled tuth is aight,er mw im filled tuth aight
Will be office around 4 pm. Now i am going hospital.,will be office around NUM pm now i am going hospital
Actually i'm waiting for 2 weeks when they start putting ad.,actually i m waiting NUM weeks when they start putting ad
Anything lor if they all go then i go lor...,anything lor they all go then i go lor
U free on sat rite? U wan 2 watch infernal affairs wif me n darren n mayb xy?,u free sat rite u wan NUM watch infernal affairs wif me n darren n mayb xy
