original,cleaned
Every monday..nxt week vl be completing..,every monday nxt week vl be completing
Might ax well im there.,might ax well im there
Just chill for another 6hrs. If you could sleep the pain is not a surgical emergency so see how it unfolds. Okay,just chill another 6hrs you could sleep pain not surgical emergency so see how it unfolds okay
Yeah I'll try to scrounge something up,yeah i ll try scrounge something up
Crazy ar he's married. Ü like gd looking guys not me. My frens like say he's korean leona's fave but i dun thk he is. Aft some thinking mayb most prob i'll go.,crazy ar he s married ü like gd looking guys not me my frens like say he s korean leona s fave i dun thk he aft some thinking mayb most prob i ll go
Were somewhere on Fredericksburg,were somewhere fredericksburg
Que pases un buen tiempo or something like that,que pases un buen tiempo something like that
Is it ok if I stay the night here? Xavier has a sleeping bag and I'm getting tired,it ok i stay night here xavier has sleeping bag i m getting tired
She doesnt need any test.,she doesnt need any test
"Nothing much, chillin at home. Any super bowl plan?",nothing much chillin at home any super bowl plan
"FREE2DAY sexy St George's Day pic of Jordan!Txt PIC to 89080 dont miss out, then every wk a saucy celeb!4 more pics c PocketBabe.co.uk 0870241182716 £3/wk",free2day sexy st george s day pic jordan txt pic NUM dont miss out then every wk saucy celeb NUM more pics c pocketbabe co uk PHONE £ NUM wk
Bugis oso near wat...,bugis oso near wat
Yo theres no class tmrw right?,yo theres no class tmrw right
Let Ur Heart Be Ur Compass Ur Mind Ur Map Ur Soul Ur Guide And U Will Never loose in world....gnun - Sent via WAY2SMS.COM,let ur heart be ur compass ur mind ur map ur soul ur guide u will never loose world gnun sent via way2sms com
"Goodnight, sleep well da please take care pa. Please.",goodnight sleep well da please take care pa please
Baaaaabe! I misss youuuuu ! Where are you ? I have to go and teach my class at 5 ...,baaaaabe i misss youuuuu where you i have go teach my class at NUM
Convey my regards to him,convey my regards him
U ned to convince him tht its not possible witot hurting his feeling its the main,u ned convince him tht its not possible witot hurting his feeling its main
"Good afternoon loverboy ! How goes you day ? Any luck come your way? I think of you, sweetie and send my love across the sea to make you smile and happy",good afternoon loverboy how goes you day any luck come your way i think you sweetie send my love across sea make you smile happy
If i start sending blackberry torch to nigeria will you find buyer for me?like 4a month. And tell dad not to buy bb from anyone oh.,i start sending blackberry torch nigeria will you find buyer me like 4a month tell dad not buy bb from anyone oh
"&lt;#&gt; %of pple marry with their lovers... becz they hav gud undrstndng dat avoids problems. i sent dis 2 u, u wil get gud news on friday by d person you like. And tomorrow will be the best day of your life. Dont break this chain. If you break you will suffer. send this to  &lt;#&gt;  frnds in &lt;#&gt;  mins whn u read...",lt gt pple marry with their lovers becz they hav gud undrstndng dat avoids problems i sent dis NUM u u wil get gud news friday by d person you like tomorrow will be best day your life dont break this chain you break you will suffer send this lt gt frnds lt gt mins whn u read
Yo dude guess who just got arrested the other day,yo dude guess who just got arrested other day
Shuhui say change 2 suntec steamboat? U noe where? Where r u now?,shuhui say change NUM suntec steamboat u noe where where r u now
What does the dance river do?,what does dance river do
"Yetunde, i'm sorry but moji and i seem too busy to be able to go shopping. Can you just please find some other way to get what you wanted us to get. Please forgive me. You can reply free via yahoo messenger.",yetunde i m sorry moji i seem too busy be able go shopping can you just please find some other way get what you wanted us get please forgive me you can reply free via yahoo messenger
Hey i will be really pretty late... You want to go for the lesson first? I will join you. I'm only reaching tp mrt,hey i will be really pretty late you want go lesson first i will join you i m only reaching tp mrt
"HOT LIVE FANTASIES call now 08707509020 Just 20p per min NTT Ltd, PO Box 1327 Croydon CR9 5WB 0870..k",hot live fantasies call now PHONE just 20p per min ntt ltd po box NUM croydon cr9 5wb NUM k
Bbq this sat at mine from 6ish. Ur welcome 2 come,bbq this sat at mine from 6ish ur welcome NUM come
"I don't know, same thing that's wrong everyso often, he panicks starts goin on bout not bein good enough …",i don t know same thing that s wrong everyso often he panicks starts goin bout not bein good enough …
Alright. I'm out--have a good night!,alright i m out have good night
Did you try making another butt.,did you try making another butt
Hope you are feeling great. Pls fill me in. Abiola,hope you feeling great pls fill me abiola
I though we shd go out n have some fun so bar in town or something – sound ok?,i though we shd go out n have some fun so bar town something – sound ok
"1) Go to write msg 2) Put on Dictionary mode 3)Cover the screen with hand, 4)Press  &lt;#&gt; . 5)Gently remove Ur hand.. Its interesting..:)",NUM go write msg NUM put dictionary mode NUM cover screen with hand NUM press lt gt NUM gently remove ur hand its interesting
"Bears Pic Nick, and Tom, Pete and ... Dick. In fact, all types try gay chat with photo upload call 08718730666 (10p/min). 2 stop texts call 08712460324",bears pic nick tom pete dick fact all types try gay chat with photo upload call PHONE 10p min NUM stop texts call PHONE
"500 New Mobiles from 2004, MUST GO! Txt: NOKIA to No: 89545 & collect yours today!From ONLY £1 www.4-tc.biz 2optout 087187262701.50gbp/mtmsg18 TXTAUCTION",NUM new mobiles from NUM must go txt nokia no NUM collect yours today from only £ NUM URL 2optout PHONE 50gbp mtmsg18 txtauction
We're finally ready fyi,we re finally ready fyi
Auntie huai juan never pick up her phone,auntie huai juan never pick up her phone
Double Mins & Double Txt & 1/2 price Linerental on Latest Orange Bluetooth mobiles. Call MobileUpd8 for the very latest offers. 08000839402 or call2optout/LF56,double mins double txt NUM NUM price linerental latest orange bluetooth mobiles call mobileupd8 very latest offers PHONE call2optout lf56
"Ya tel, wats ur problem..",ya tel wats ur problem
No. 1 Nokia Tone 4 ur mob every week! Just txt NOK to 87021. 1st Tone FREE ! so get txtin now and tell ur friends. 150p/tone. 16 reply HL 4info,no NUM nokia tone NUM ur mob every week just txt nok NUM 1st tone free so get txtin now tell ur friends 150p tone NUM reply hl 4info
i dnt wnt to tlk wid u,i dnt wnt tlk wid u
"We spend our days waiting for the ideal path to appear in front of us.. But what we forget is.. ""paths are made by walking.. not by waiting.."" Goodnight!",we spend our days waiting ideal path appear front us what we forget paths made by walking not by waiting goodnight
Its ok my arm is feeling weak cuz i got a shot so we can go another time,its ok my arm feeling weak cuz i got shot so we can go another time
Please reserve ticket on saturday eve from chennai to thirunelvali and again from tirunelvali to chennai on sunday eve...i already see in net..no ticket available..i want to book ticket through tackle ..,please reserve ticket saturday eve from chennai thirunelvali again from tirunelvali chennai sunday eve i already see net no ticket available i want book ticket through tackle
"Storming msg: Wen u lift d phne, u say ""HELLO"" Do u knw wt is d real meaning of HELLO?? . . . It's d name of a girl..! . . . Yes.. And u knw who is dat girl?? ""Margaret Hello"" She is d girlfrnd f Grahmbell who invnted telphone... . . . . Moral:One can 4get d name of a person, bt not his girlfrnd... G o o d n i g h t . . .@",storming msg wen u lift d phne u say hello do u knw wt d real meaning hello it s d name girl yes u knw who dat girl margaret hello she d girlfrnd f grahmbell who invnted telphone moral one can 4get d name person bt not his girlfrnd g o o d n i g h t
That's ok. I popped in to ask bout something and she said you'd been in. Are you around tonght wen this girl comes?,that s ok i popped ask bout something she said you d been you around tonght wen this girl comes
All e best 4 ur exam later.,all e best NUM ur exam later
Hope ur head doesn't hurt 2 much ! Am ploughing my way through a pile of ironing ! Staying in with a chinky tonight come round if you like.,hope ur head doesn t hurt NUM much am ploughing my way through pile ironing staying with chinky tonight come round you like
Oh k.i think most of wi and nz players unsold.,oh k i think most wi nz players unsold
"Haha... Where got so fast lose weight, thk muz go 4 a month den got effect... Gee,later we go aust put bk e weight.",haha where got so fast lose weight thk muz go NUM month den got effect gee later we go aust put bk e weight
"I wonder how you got online, my love ? Had you gone to the net cafe ? Did you get your phone recharged ? Were you on a friends net ? I think of you, boytoy",i wonder how you got online my love had you gone net cafe did you get your phone recharged were you friends net i think you boytoy
"Haha just kidding, papa needs drugs",haha just kidding papa needs drugs
"Thk shld b can... Ya, i wana go 4 lessons... Haha, can go for one whole stretch...",thk shld b can ya i wana go NUM lessons haha can go one whole stretch
Oh ok..,oh ok
R we still meeting 4 dinner tonight?,r we still meeting NUM dinner tonight
Thats cool! I am a gentleman and will treat you with dignity and respect.,thats cool i am gentleman will treat you with dignity respect
Shall i start from hear.,shall i start from hear
Then we wait 4 u lor... No need 2 feel bad lar...,then we wait NUM u lor no need NUM feel bad lar
No did you check? I got his detailed message now,no did you check i got his detailed message now
You have registered Sinco as Payee. Log in at icicibank.com and enter URN  &lt;#&gt;  to confirm. Beware of frauds. Do NOT share or disclose URN to anyone.,you have registered sinco as payee log at icicibank com enter urn lt gt confirm beware frauds do not share disclose urn anyone
"No, I decided that only people who care about stuff vote and caring about stuff is for losers",no i decided that only people who care about stuff vote caring about stuff losers
Kaiez... Enjoy ur tuition... Gee... Thk e second option sounds beta... I'll go yan jiu den msg u...,kaiez enjoy ur tuition gee thk e second option sounds beta i ll go yan jiu den msg u
You have registered Sinco as Payee. Log in at icicibank.com and enter URN  &lt;#&gt;  to confirm. Beware of frauds. Do NOT share or disclose URN to anyone.,you have registered sinco as payee log at icicibank com enter urn lt gt confirm beware frauds do not share disclose urn anyone
cool. We will have fun practicing making babies!,cool we will have fun practicing making babies
Actually getting ready to leave the house.,actually getting ready leave house
K..k..any special today?,k k any special today
"URGENT, IMPORTANT INFORMATION FOR O2 USER. TODAY IS YOUR LUCKY DAY! 2 FIND OUT WHY LOG ONTO HTTP://WWW.URAWINNER.COM THERE IS A FANTASTIC SURPRISE AWAITING FOR YOU",urgent important information o2 user today your lucky day NUM find out why log onto URL there fantastic surprise awaiting you
Then we gotta do it after that,then we gotta do it after that
"I've got ten bucks, jay is being noncomittal",i ve got ten bucks jay being noncomittal
Where at were hungry too,where at were hungry too
Pls speak to that customer machan.,pls speak that customer machan
somewhere out there beneath the pale moon light someone think in of u some where out there where dreams come true... goodnite &amp; sweet dreams,somewhere out there beneath pale moon light someone think u some where out there where dreams come true goodnite amp sweet dreams
"Wen ur lovable bcums angry wid u, dnt take it seriously.. Coz being angry is d most childish n true way of showing deep affection, care n luv!.. kettoda manda... Have nice day da.",wen ur lovable bcums angry wid u dnt take it seriously coz being angry d most childish n true way showing deep affection care n luv kettoda manda have nice day da
Dear U've been invited to XCHAT. This is our final attempt to contact u! Txt CHAT to 86688 150p/MsgrcvdHG/Suite342/2Lands/Row/W1J6HL LDN 18 yrs,dear u ve been invited xchat this our final attempt contact u txt chat NUM 150p msgrcvdhg suite342 2lands row w1j6hl ldn NUM yrs
So wats ur opinion abt him and how abt is character?,so wats ur opinion abt him how abt character
Jay is snickering and tells me that x is totally fucking up the chords as we speak,jay snickering tells me that x totally fucking up chords as we speak
No..few hours before.went to hair cut .,no few hours before went hair cut
No wonder... Cos i dun rem seeing a silver car... But i thk i saw a black one...,no wonder cos i dun rem seeing silver car i thk i saw black one
Lmao. Take a pic and send it to me.,lmao take pic send it me
"""Speak only when you feel your words are better than the silence..."" Gud mrng:-)",speak only when you feel your words better than silence gud mrng
No. She's currently in scotland for that.,no she s currently scotland that
Do you work all this week ?,do you work all this week
Congratulations ur awarded either £500 of CD gift vouchers & Free entry 2 our £100 weekly draw txt MUSIC to 87066 TnCs www.Ldew.com 1 win150ppmx3age16,congratulations ur awarded either £ NUM cd gift vouchers free entry NUM our £ NUM weekly draw txt music NUM tncs URL NUM win150ppmx3age16
Lol great now im getting hungry.,lol great now im getting hungry
Yes.. now only saw your message..,yes now only saw your message
I'll be at mu in like  &lt;#&gt;  seconds,i ll be at mu like lt gt seconds
Ok...,ok
THING R GOOD THANX GOT EXAMS IN MARCH IVE DONE NO REVISION? IS FRAN STILL WITH BOYF? IVE GOTTA INTERVIW 4 EXETER BIT WORRIED!x,thing r good thanx got exams march ive done no revision fran still with boyf ive gotta interviw NUM exeter bit worried x
"Tell you what, if you make a little spreadsheet and track whose idea it was to smoke to determine who ""smokes too much"" for the entire month of february, I'll come up",tell you what you make little spreadsheet track whose idea it was smoke determine who smokes too much entire month february i ll come up
For sale - arsenal dartboard. Good condition but no doubles or trebles!,sale arsenal dartboard good condition no doubles trebles
Don't look back at the building because you have no coat and i don't want you to get more sick. Just hurry home and wear a coat to the gym!!!,don t look back at building because you have no coat i don t want you get more sick just hurry home wear coat gym
"My painful personal thought- ""I always try to keep everybody happy all the time. But nobody recognises me when i am alone""",my painful personal thought i always try keep everybody happy all time nobody recognises me when i am alone
Thanks for ve lovely wisheds. You rock,thanks ve lovely wisheds you rock
You intrepid duo you! Have a great time and see you both soon.,you intrepid duo you have great time see you both soon
I asked sen to come chennai and search for job.,i asked sen come chennai search job
Dad went out oredi...,dad went out oredi
"I jus hope its true that  missin me cos i'm really missin him! You haven't done anything to feel guilty about, yet.",i jus hope its true that missin me cos i m really missin him you haven t done anything feel guilty about yet
Wat so late still early mah. Or we juz go 4 dinner lor. Aiya i dunno...,wat so late still early mah we juz go NUM dinner lor aiya i dunno
"Arms fine, how's Cardiff and uni?",arms fine how s cardiff uni
In fact when do you leave? I think addie goes back to school tues or wed,fact when do you leave i think addie goes back school tues wed
"Cool breeze... Bright sun... Fresh flower... Twittering birds... All these waiting to wish u: ""GOODMORNING &amp; HAVE A NICE DAY"" :)",cool breeze bright sun fresh flower twittering birds all these waiting wish u goodmorning amp have nice day
Ya:)going for restaurant..,ya going restaurant
"Its ok., i just askd did u knw tht no?",its ok i just askd did u knw tht no
Free 1st week entry 2 TEXTPOD 4 a chance 2 win 40GB iPod or £250 cash every wk. Txt POD to 84128 Ts&Cs www.textpod.net custcare 08712405020.,free 1st week entry NUM textpod NUM chance NUM win 40gb ipod £ NUM cash every wk txt pod NUM ts cs URL custcare PHONE
Those ducking chinchillas,those ducking chinchillas
I am in a marriage function,i am marriage function
Looks like u wil b getting a headstart im leaving here bout 2.30ish but if u r desperate for my company I could head in earlier-we were goin to meet in rummer.,looks like u wil b getting headstart im leaving here bout NUM 30ish u r desperate my company i could head earlier we were goin meet rummer
Don‘t give a flying monkeys wot they think and I certainly don‘t mind. Any friend of mine and all that!,don‘t give flying monkeys wot they think i certainly don‘t mind any friend mine all that
As a registered optin subscriber ur draw 4 £100 gift voucher will be entered on receipt of a correct ans to 80062 Whats No1 in the BBC charts,as registered optin subscriber ur draw NUM £ NUM gift voucher will be entered receipt correct ans NUM whats no1 bbc charts
say thanks2.,say thanks2
Msg me when rajini comes.,msg me when rajini comes
Ya! when are ü taking ure practical lessons? I start in june..,ya when ü taking ure practical lessons i start june
"That's good, because I need drugs",that s good because i need drugs
Stupid.its not possible,stupid its not possible
Can ü all decide faster cos my sis going home liao..,can ü all decide faster cos my sis going home liao
Summers finally here! Fancy a chat or flirt with sexy singles in yr area? To get MATCHED up just reply SUMMER now. Free 2 Join. OptOut txt STOP Help08714742804,summers finally here fancy chat flirt with sexy singles yr area get matched up just reply summer now free NUM join optout txt stop help08714742804
U sleeping now.. Or you going to take? Haha.. I got spys wat.. Me online checking n replying mails lor..,u sleeping now you going take haha i got spys wat me online checking n replying mails lor
CLAIRE here am havin borin time & am now alone U wanna cum over 2nite? Chat now 09099725823 hope 2 C U Luv CLAIRE xx Calls£1/minmoremobsEMSPOBox45PO139WA,claire here am havin borin time am now alone u wanna cum over 2nite chat now PHONE hope NUM c u luv claire xx calls£ NUM minmoremobsemspobox45po139wa
"Fighting with the world is easy, u either win or lose bt fightng with some1 who is close to u is dificult if u lose - u lose if u win - u still lose.",fighting with world easy u either win lose bt fightng with some1 who close u dificult u lose u lose u win u still lose
Bought one ringtone and now getting texts costing 3 pound offering more tones etc,bought one ringtone now getting texts costing NUM pound offering more tones etc
"Yalru lyfu astne chikku.. Bt innu mundhe lyf ali halla ke bilo (marriage)program edhae, so lyf is nt yet ovr chikku..ali vargu lyfu meow meow:-D",yalru lyfu astne chikku bt innu mundhe lyf ali halla ke bilo marriage program edhae so lyf nt yet ovr chikku ali vargu lyfu meow meow d
Kinda. First one gets in at twelve! Aah. Speak tomo,kinda first one gets at twelve aah speak tomo
"09066362231 URGENT! Your mobile No 07xxxxxxxxx won a £2,000 bonus caller prize on 02/06/03! this is the 2nd attempt to reach YOU! call 09066362231 ASAP!",PHONE urgent your mobile no 07xxxxxxxxx won £ NUM NUM bonus caller prize NUM NUM NUM this 2nd attempt reach you call PHONE asap
Ok good then i later come find ü... C lucky i told ü to go earlier... Later pple take finish ü no more again...,ok good then i later come find ü c lucky i told ü go earlier later pple take finish ü no more again
Wat makes u thk i'll fall down. But actually i thk i'm quite prone 2 falls. Lucky my dad at home i ask him come n fetch me already.,wat makes u thk i ll fall down actually i thk i m quite prone NUM falls lucky my dad at home i ask him come n fetch me already
"YOU 07801543489 are guaranteed the latests Nokia Phone, a 40GB iPod MP3 player or a £500 prize! Txt word:COLLECT to No:83355! TC-LLC NY-USA 150p/Mt msgrcvd18+",you PHONE guaranteed latests nokia phone 40gb ipod mp3 player £ NUM prize txt word collect no NUM tc llc ny usa 150p mt msgrcvd18
Your account has been refilled successfully by INR  &lt;DECIMAL&gt; . Your KeralaCircle prepaid account balance is Rs  &lt;DECIMAL&gt; . Your Transaction ID is KR &lt;#&gt; .,your account has been refilled successfully by inr lt decimal gt your keralacircle prepaid account balance rs lt decimal gt your transaction id kr lt gt
I wont touch you with out your permission.,i wont touch you with out your permission
Hi its LUCY Hubby at meetins all day Fri & I will B alone at hotel U fancy cumin over? Pls leave msg 2day 09099726395 Lucy x Calls£1/minMobsmoreLKPOBOX177HP51FL,hi its lucy hubby at meetins all day fri i will b alone at hotel u fancy cumin over pls leave msg 2day PHONE lucy x calls£ NUM minmobsmorelkpobox177hp51fl
"7 wonders in My WORLD 7th You 6th Ur style 5th Ur smile 4th Ur Personality 3rd Ur Nature 2nd Ur SMS and 1st ""Ur Lovely Friendship""... good morning dear",NUM wonders my world 7th you 6th ur style 5th ur smile 4th ur personality 3rd ur nature 2nd ur sms 1st ur lovely friendship good morning dear
Take some small dose tablet for fever,take some small dose tablet fever
Oh. U must have taken your REAL Valentine out shopping first.,oh u must have taken your real valentine out shopping first
"Just sent you an email – to an address with incomm in it, is that right?",just sent you email – address with incomm it that right
"Will do, you gonna be at blake's all night? I might be able to get out of here a little early",will do you gonna be at blake s all night i might be able get out here little early
"Friendship is not a game to play, It is not a word to say, It doesn\'t start on March and ends on May, It is tomorrow, yesterday, today and e",friendship not game play it not word say it doesn t start march ends may it tomorrow yesterday today e
"Nice. Wait...should you be texting right now? I'm not gonna pay your ticket, ya know!",nice wait should you be texting right now i m not gonna pay your ticket ya know
I'm watching lotr w my sis dis aft. So u wan 2 meet me 4 dinner at nite a not?,i m watching lotr w my sis dis aft so u wan NUM meet me NUM dinner at nite not
Why you keeping me away like this,why you keeping me away like this
I think its far more than that but find out. Check google maps for a place from your dorm.,i think its far more than that find out check google maps place from your dorm
My trip was ok but quite tiring lor. Uni starts today but it's ok 4 me cos i'm not taking any modules but jus concentrating on my final yr project.,my trip was ok quite tiring lor uni starts today it s ok NUM me cos i m not taking any modules jus concentrating my final yr project
Have you always been saying welp?,have you always been saying welp
"I'm a guy, browsin is compulsory",i m guy browsin compulsory
Ok...,ok
Purity of friendship between two is not about smiling after reading the forwarded message..Its about smiling just by seeing the name. Gud evng musthu,purity friendship between two not about smiling after reading forwarded message its about smiling just by seeing name gud evng musthu
"Sorry, I'll call later",sorry i ll call later
"(I should add that I don't really care and if you can't I can at least get this dude to fuck off but hey, your money if you want it)",i should add that i don t really care you can t i can at least get this dude fuck off hey your money you want it
"Hello lover! How goes that new job? Are you there now? Are you happy? Do you think of me? I wake, my slave and send you a teasing kiss from across the sea",hello lover how goes that new job you there now you happy do you think me i wake my slave send you teasing kiss from across sea
I told your number to gautham..,i told your number gautham
Tell them no need to investigate about me anywhere.,tell them no need investigate about me anywhere
Ok i juz receive..,ok i juz receive
"Cant believe i said so many things to you this morning when all i really wanted to say was good morning, i love you! Have a beautiful morning. See you in the library later.",cant believe i said so many things you this morning when all i really wanted say was good morning i love you have beautiful morning see you library later
"Your account has been credited with 500 FREE Text Messages. To activate, just txt the word: CREDIT to No: 80488 T&Cs www.80488.biz",your account has been credited with NUM free text messages activate just txt word credit no NUM t cs URL
In the end she might still vomit but its okay. Not everything will come out.,end she might still vomit its okay not everything will come out
How are you with moneY...as in to you...money aint a thing....how are you sha!,how you with money as you money aint thing how you sha
It has everything to do with the weather. Keep extra warm. Its a cold but nothing serious. Pls lots of vitamin c,it has everything do with weather keep extra warm its cold nothing serious pls lots vitamin c
Hey gals.. Anyone of u going down to e driving centre tmr?,hey gals anyone u going down e driving centre tmr
I'm always on yahoo messenger now. Just send the message to me and i.ll get it you may have to send it in the mobile mode sha but i.ll get it. And will reply.,i m always yahoo messenger now just send message me i ll get it you may have send it mobile mode sha i ll get it will reply
I'm putting it on now. It should be ready for  &lt;TIME&gt;,i m putting it now it should be ready lt time gt
